{"format":"uarch-native-test-registry/1","registry_hash":"sha256:05709417a8e8729c304aa5f32efdc73abb7fc5460a753a26aca15a9333dc5833","semantics_revision":"U0011-stage2/1","test_only_specs":[{"hardware_spec_hash":"sha256:0e2fee98531a29aced20bcdedbb33a81a70f7566f1fb85393caf9e327cb5cf8e","rationale":"Finite K06/K07 core-clock stipulation; K2 test only."},{"hardware_spec_hash":"sha256:164c5142d50e2239206681dfa4cca9d23ff9aa6d22af0ed8a8841d7986d5bb69","rationale":"Independent finite first-use clock fixture; no hardware fidelity."},{"hardware_spec_hash":"sha256:3654d7cd407b6109726b7227d71d4f661a20ac5b45b55805f8df762ca07a0390","rationale":"Independent finite first-use clock fixture; no hardware fidelity."},{"hardware_spec_hash":"sha256:711e03e940181c59d418efea652ead2af13c9f40c7405f5928781b93a9d45f37","rationale":"Finite K06/K07 core-clock stipulation; K2 test only."},{"hardware_spec_hash":"sha256:d1a9ad1184a9811cb1e49e07d2ee728bd030bd22afb0f168038fccaa691e7c07","rationale":"Finite K06/K07 core-clock stipulation; K2 test only."}]}
